{
    "_type": "sec_certs.sample.fips.FIPSCertificate",
    "dgst": "184097a88a9b4ad9",
    "cert_id": 3518,
    "web_data": {
        "_type": "sec_certs.sample.fips.FIPSCertificate.WebData",
        "module_name": null,
        "validation_history": null,
        "vendor_url": null,
        "vendor": null,
        "certificate_pdf_url": null,
        "module_type": null,
        "standard": null,
        "status": null,
        "level": null,
        "caveat": null,
        "exceptions": null,
        "embodiment": null,
        "description": null,
        "tested_conf": null,
        "hw_versions": null,
        "fw_versions": null,
        "sw_versions": null,
        "mentioned_certs": null,
        "historical_reason": null,
        "date_sunset": null,
        "revoked_reason": null,
        "revoked_link": null
    },
    "pdf_data": {
        "_type": "sec_certs.sample.fips.FIPSCertificate.PdfData",
        "keywords": {},
        "policy_metadata": {},
        "module_algorithms": {
            "_type": "Set",
            "elements": []
        },
        "policy_algorithms": {
            "_type": "Set",
            "elements": []
        },
        "is_br1_format": false,
        "br1_deviations": 0,
        "br1_tables": null
    },
    "heuristics": {
        "_type": "sec_certs.sample.fips.FIPSCertificate.Heuristics",
        "algorithms": {
            "_type": "Set",
            "elements": []
        },
        "extracted_versions": {
            "_type": "Set",
            "elements": []
        },
        "cpe_matches": null,
        "verified_cpe_matches": null,
        "related_cves": null,
        "policy_prunned_references": {
            "_type": "Set",
            "elements": []
        },
        "module_prunned_references": {
            "_type": "Set",
            "elements": []
        },
        "policy_processed_references": {
            "_type": "sec_certs.sample.certificate.References",
            "directly_referenced_by": null,
            "indirectly_referenced_by": null,
            "directly_referencing": null,
            "indirectly_referencing": null
        },
        "module_processed_references": {
            "_type": "sec_certs.sample.certificate.References",
            "directly_referenced_by": null,
            "indirectly_referenced_by": null,
            "directly_referencing": null,
            "indirectly_referencing": null
        },
        "direct_transitive_cves": null,
        "indirect_transitive_cves": null
    },
    "state": {
        "_type": "sec_certs.sample.fips.InternalState",
        "module": {
            "_type": "sec_certs.sample.document_state.DocumentState",
            "download_ok": true,
            "convert_ok": true,
            "extract_ok": false,
            "source_hash": null,
            "txt_hash": null,
            "json_hash": null
        },
        "policy": {
            "_type": "sec_certs.sample.document_state.DocumentState",
            "download_ok": true,
            "convert_ok": true,
            "extract_ok": false,
            "source_hash": "36b63890182f0aed29b305a0b4acc0d70b657262516f4be69138c70c2abdb1f1",
            "txt_hash": "cc1f8d0f7bb759894e81cbbfd1cfe02cdc443879fd47d3306f2a1b419fbf2872",
            "json_hash": null
        }
    }
}
